Abstract,IsLitigated
" A mutual fund securitization process permitting the trading of open end mutual funds and linked derivative securities on or off the floor of a National Securities Exchange. The targeted individual open end mutual fund or group of open end mutual funds, selected through a screening process is securitized through the creation of a new, separate security. This new security is preferably a   closed end fund of funds   and linked derivative securities, which synthetically replicate the statistical relationship of the defined individual or group of open end mutual funds. The maintenance of financial records for the new security is maintained by electronically storing dividend, capital gains and income received from the open end funds which have been invested in, and calculating pro-forma financial statements to disseminate to shareholders and all relevant parties. ",No
" Systems and methods are disclosed for providing a framework for operational risk management and control. In the disclosed systems and methods, roles and responsibilities may be defined for at least one function of an enterprise, and at least one control objective may be defined to identify at least one operational risk associated with at least one of the roles and responsibilities. Further, at least one control standard may be defined to describe an activity to be taken to achieve the at least one control objective. Finally, certification may be performed to certify adherence to the at least one control standard. In one embodiment, a periodic certification process may be implemented to determine compliance with the at least one control standard by a person responsible for the performance of the control standard. ",Yes
" A system is described by means of which it proves possible to set up conversations between an institution, for example a financial institution, such as a bank or similar, and an end client, where the conversations may be initiated both by the institution and by the client, using the transmission of SMS short messages for this purpose. The system includes a set of components, amongst which we may single out an institution HOST, a first server with an associated first database, a second server and an associated second database, and a third server implemented as a communications port through which the different communications operators are accessed for the establishment of conversations with end clients. The system also envisages the use of personal access passwords for every application or group of applications. ",Yes
" A switch engine module receive interest rate risk portfolios from a plurality of traders, and for each prospective trader, provides available switches based on positions in other counterparty portfolios that offset the viewing traders' positions. The offsetting positions are encoded with credit preference information in order to identify eligible trades based on both counterparties credit preferences. In particular, an embodiment provides for a switch auction whereby users can use an auction process to trade for forward rate agreement switches with other counterparties, for example, in a two-way or many-to-many auction. In the switch auction, the price is predetermined by the system prior to the auction so that parties can opt out of the transaction if desired. The credit preferences of the participating traders are taken in consideration in making matches. ",Yes
" A system and method that provides an electronic menu wirelessly interconnected with a restaurant's server is provided. The restaurant server provides the electronic menu device with the menu items and menu software used to navigate through the menu items and options. The electronic menu provides the patron with details regarding menu items including detailed descriptions, photographs and videos, and nutritional information. The patron's order is wirelessly transmitted to the restaurant server and communicated to the restaurant kitchen staff. The electronic menu device is also used to request assistance and request the status of an order that has been placed. The patron can pay using the electronic menu device by providing credit card information or the patron can request assistance and provide payment, such as cash, to the restaurant's wait staff. ",Yes
" A mobile telephone (7) comprises a telephone function unit (10) having a communication function and an Internet connection function and an electronic money function unit (12) for storing a value and performing a value processing. The telephone function unit (10) can access a service site of an electronic money server (2) through a base station (5) over the Internet (4). When the user requests the service site to write a value through the telephone function unit (10), the electronic money server (2) sends a write command for the electronic money function unit (12) to write the value to the mobile telephone (7). The telephone function unit (10) enters the write command into the electronic money function unit (12) to allow the electronic money function unit (12) to write the value. ",Yes
" A system and method for the purchase of products, wherein a database account is credited with virtual coupons. Each virtual coupon is associated with a maximum value and a specified product. When a purchase is made, the coupon is debited from the account upon presentation of a financial card at a POS terminal, and any difference between the maximum value of the coupon and the actual purchase price is stored in the database. In one embodiment, coupons are issued through a government benefits program, such as the federally funded WIC (Women, Infants, Children) program. The financial card may also be associated with a second account, such as a credit or debit card account. The second account may be used to purchase products other than those specified by the virtual coupons. ",Yes
" An apparatus ( 10, 240, 300 ) includes a signpost ( 11, 241-256, 322, 612, 623, 626-628, 652, 661, 682, 686, 703 ) which transmits signpost signals ( 24 ) that are received by a tag ( 12, 271-275, 301-316, 395-397, 616-618, 641-643, 653, 656-657, 662-664, 679, 708, 711 ). The tag in turn transmits radio frequency beacon signals ( 72 ) which are received by a reader ( 13, 261, 319, 521-530 ) The tag can vary the duration of the beacon signals, for example in dependence on whether it is currently receiving a signpost signal. Further, the tag can dynamically vary the transmission rate and/or transmission power of the beacon signals, for example following receipt of a signpost signal. Varying these parameters can facilitate compliance with governmental regulations. ",No
" Trading cards consists of a single rule card and a plurality of character cards. The rule card is formed with a data recording area on its front surface. The data recording area of the rule card is mechanically readably recorded with rule program data determining a rule of an interactive game. Each character card is formed with a data recording area on its front surface. The data recording area of the character card is mechanically readably recorded with parameter data. An electronic game machine is loaded with a cartridge, and on the electronic game machine, the interactive game according to the rule program data read from the rule card and the parameter data read from the character card is executed on the basis of a game program of the cartridge. ",Yes
" The invention relates to a method and a computer for coordinating an electronic credit qualification form between an Internet user and a plurality of lending institutions via the Internet. This method involves displaying documents in a web site, and receiving credit data forming placed on the web site. After receiving this data a special loan processing computer applies a filter to the data. The filter comprises loan selection criteria provided by lending institutions which allows these institutions to filter out loan applications that they do not want. Next, after the data is filtered, it is transmitted to a plurality of lending institutions. Finally, the computer and the method then controls and coordinates communication between these lending institutions and the Internet user to match borrowers and lenders via the Internet. ",No
" A system and method are described for activating programming downloaded to electronic devices. The method involves the generation of an encrypted (or encoded) activation key which is produced in response to the network address (i.e. media access control (MAC) address) of the electronic device to which the download is directed. Programming can only be activated within the electronic device upon a match being detected between the activation key and the network address of the electronic device. Typically, the programming would be downloaded from a web site, such as from a manufacturer of the electronic device, in exchange for receipt of a payment preferably executed as an online financial transaction. The system and method prevent the copying of downloaded programs for a given electronic device for use by other users. ",Yes
" A coinless video game system includes a plurality of electronic video game terminals, a game server corresponding to each player terminal, and a central control network for administering and controlling games and player accounts. A player initially establishes a player account in the central control network and receives a player I.D. card bearing the player's account number and other relevant information. Players use these I.D. cards to establish sessions at a player terminal. The server provides a random number to each player terminal at predefined intervals to determine wins and loses for each game selected by a player. Waged amounts are then debited or credited to a player's account in the central control network. Players may redeem any account balance from a cashier associated with the central control network. ",No
" A purchaser purchases a purchaser record medium, to which game software is rewritten or reloaded, at a shop. The purchaser writes data representing a predetermined amount of money to the purchaser record medium. At that time, the purchaser also writes purchaser inherent data to the purchaser record medium. When game software is requested from a computer of the shop, data recorded in the purchaser record medium is sent to software deliverers through communication networks, and is collated with past data recorded in computers. If matched, the game software is delivered from the software deliverer to the shop, and is then recorded in the purchase record medium. Simultaneously, additional data relating to the game software is recorded in the purchase record medium and in the computers of the software deliverers. ",No
" An anonymous trading system (FIG. 1) identifies the best bids and offers (QuoteSubmit, FIG. 3) from those counterparties (WS Alal ) with which each party (WS A1b1, WS A1b2, . . . WSA2a2) is currently eligible to deal, while maintaining the anonymity of the potential counterparty and the confidentiality of any specific credit limitations imposed by the anonymous potential counterparty. To that end, each bid or offer (QuoteSubmit, FIG. 3) for a particular type of financial instrument is prescreened by the system for compatibility with limited credit information (for example, a one bit flag indicating whether a predetermined limit has already been exceeded) and an anonymous   Dealable   price (24,26) is calculated for each of the traders (WS A1b, . . . WS A2a) dealing with that particular financial instrument. ",No
" The invention relates to a control system and method for a lighting device (1) adapted to be controlled by means of control signals in compliance with a high-speed transmission protocol. The system according to the invention comprises a central control unit (2) adapted to transmit control signals (s1) in compliance with said high speed transmission protocol, a plurality of peripheral control units (3) adapted to activate said lighting devices.  The invention is characterised in that said system comprises first means (4) adapted to convert said control signals (s1) transmitted by said central unit in one or more low-speed data flows (s2) and second means (5) adapted to transmit said low-speed data flow (s2) on at least one supply line (6) adapted to supply electrical power to said lighting devices. ",Yes
" A gaming apparatus which comprises a slot machine capable of accepting either paper currency, preprinted coupons, or cash out slips. The slot machine also includes a printer that prints and dispenses cash out slips which include a bar code representing a unique identification that provides the amount of   winnings  . The cash out slips can be scanned into a separate currency dispenser at a Cashier's Station for receiving currency, either from the dispenser or from an attendant. A central processing unit (CPU) generates the unique codes for regulating the game to be played, the wager limits of the game and the validity of the free play coupons or the cash out tickets. The above gaming system avoids having to use coins or tokens in the operation of slot machines. ",No
" A smart card personalization system maintains a database for containing card issuer data format templates, card applications, card operating system commands, and personalization equipment specifications and provides a centralized interface of inputs and outputs to a card issuing process which dynamically adjusts to changes in the issuing process to easily permit a card issuer to change the formats, card applications, card operating systems and/or personalization equipment (130) in a card issuing process. The system interfaces to any card issuer management system (150), manages the transfer of cardholder data and card applications to the particular personalization equipment used, and maintains statistics for real-time and off-line inquiries to support critical management and reporting functions. Furthermore, the system works with a variety of security methodologies to prevent fraud. &lt;IMAGE&gt;   &lt;IMAGE&gt;   &lt;IMAGE&gt; ",No
" A network authentication system provides verification of the identity or other attributes of a network user to conduct a transaction, access data or avail themselves of other resources. The user is presented with a hierarchy of queries based on wallet-type (basic identification) and non-wallet type (more private) information designed to ensure the identity of the user and prevent fraud, false negatives and other undesirable results. A preprocessing stage may be employed to ensure correct formatting of the input information and clean up routine mistakes (such as missing digits, typos, etc.) that might otherwise halt the transaction. Queries can be presented in interactive, batch processed, or other format. The authenticator can be configured to require differing levels of input or award differing levels of authentication according to security criteria. ",No
" The present invention provides systems and methods of processing bill payments. One such method includes receiving a payment request from a customer. The payment request is for a bill associated with a vendor. The vendor may be any number of vendors including utility companies, mortgage lenders, credit card companies, financing companies for the purchase of furniture, appliances, or automobiles, and the like. The method includes verifying, using a point-of-sale device, whether the vendor is included in a group of authorizing vendors. A customer identification and a payment amount associated with the particular bill is received from the customer. The method further includes receiving a payment authorization and providing a receipt to the customer. In this manner, the customer may use a point-of-sale device to make on-time bill payments. ",Yes
" A self-service checkout system which weighs products with RFID labels for security. The system includes an RFID label affixed to a product, a scale for determining actual weight information for the product, and a computer which records a customer indication that the product is on the scale, transmits a signal to the RFID label while the product is on the scale, records a response from the RFID label, obtains identification information for the product using the response from the RFID label, obtains price and reference weight information for the product using the identification information, compares the actual weight information with the reference weight information, and initiates acceptance of payment if a difference amount between the actual weight information and the reference weight information is with a predetermined threshold.| ",Yes
A computer implemented method and system for publishing best public limits and corresponding quantity and for matching an incoming outright order against price best match limits at corresponding quantities during the continuous trading phase is provided. An incoming outright order is entered in an incoming order book side. It is determined if the incoming outright order satisfies a matching condition by evaluating the sum of the incoming outright order limit and the best match limit of the outright order book side opposing to the incoming outright order book side wherein the best match limit of the outright order book side opposing to the incoming outright order book side also considers outright order book combinations resulting to the outright order book side opposing the incoming outright order book side.,No
A method and system for mail payment evidencing includes processing a collation of mail (1020) where the collation is one of a series of mail collations being created. Payment rating parameters are determined for carrier services (1012) to be associated with the mail collation in process. It is determined if a previously generated digital token (1008) associated with a previous mail collation which was not completed is suitable for use on said mail collation in process. The previously generated digital token is utilized for the mail collation (1020) in process if the previously generated digital token is suitable for use on said mail collation in process. The created mail collations may be submitted to a carrier service (1012) with a digitally signed statement of mailing (1018). &lt;IMAGE&gt; [EP0814434A2],No
" The invention relates to clearing the payment of goods (works, services) by using a cash dispenser. The aim of the invention is to simplify for a buyer the payment of the good (work, service) chosen thereby, to perform said payment in real time and to increase the number of types of buyer accounts whose remainders can be used by the buyer for said payment. The inventive method consists in the following: a list of proposed goods (works, services) is recorded by a computer system of a processing centre, the buyer reads said list with the aid of the cash dispenser which serves the processing centre. The use of the cash dispenser for paying for the good (work, service) by the buyer is carried out with a bankcard thereof.[WO0246998A1] ",Yes
A method of including a gift card in a mailing to a customer includes receiving a request to include gift cards in mailings to each member of a group comprising one or more customers. The group includes the customer. The method also includes preparing the mailing. The mailing includes the gift card and the gift card is inactive. The method further includes sending the mailing to the customer and receiving a request from the customer to activate the gift card. The request includes an identifier of the gift card and payment for an amount of value to be assigned to the gift card. The method further includes settling a transaction involving the gift card and a recipient of the gift card. The recipient and the customer are different.,Yes
" Disclosed is a system and method for assessing environmental risk associated with a parcel of real property through the form of reports which can be generated without the significant expense and time delay of a physical site inspection. Also disclosed is a method to facilitate contaminated land transactions by reports that provide consultancy, legal, and/or financial advice based on factors determined in the absence of a property site visit. In one aspect, the disclosed method comprises several steps based on certain determinations made using commercially-available and publicly-available databases. In another aspect, the disclosed method is a way of providing financial assurance via an insurance policy with the steps of supplying an environmental risk report and automatically supplying an environmental insurance quote based upon the environmental risk report. ",No
A financial institution channel cooperation system which connects a plurality of channels among delivery channels and supply channels of a financial institution includes: a channel control apparatus installed in a delivery channel element apparatus; and a channel cooperating apparatus which encloses the channel control apparatus and can be connected to an upper apparatus or an external apparatus. The channel cooperating apparatus includes: a communication control unit which absorbs a difference between communication protocols of channels; a workflow defining unit in which a definition of a workflow in which many channels cooperate has been stored; a workflow processing unit in which a work program as a processing unit has been stored and which processes an instruction work; and a workflow control unit which executes the requested defined workflow.,Yes
" Money transfer system authorizing an escrow agent computer electronically by touch-tone telephone, computer modem, P.O.S.(point of sale) terminal, live operators, to send cash transfers from a sender's account such as their credit, debit, bank, or ATM card, or a bank account, to a recipient who accesses the money at any remote ATM type location or P.O.S.(point of sale) terminal by using cards such as a specialized magnetic cards, credit cards, debit cards, and automated teller machine(ATM) card, at anytime and anywhere. Senders can authorize the transfer by touch-tone and PIN(personal identification number) secure codes. The system can operate without pre-existing relationships, and monitor transactions and take surcharges based on transfer amounts, and use a cards tethered to ATM machines and be used with double magnetic sided cards. ",No
" Apparatus and method for trading commodities with automatic hedging for odd lot offers. The apparatus automatically accepts odd lot offers on behalf of buyers and aggregates them with other odd lot offers of the same commodity symbol until there are enough bushels to reach a predetermined threshold, or   tipping point,   which causes the system to automatically calculate the optimum number of full lot futures contracts to sell at the market price in order to offset risk associated with accepting the odd lot offers, and to automatically secure the optimum number of full lot futures contracts. The system reduces or eliminates situations where no transactions are executed due to the market's failure to reach a certain price, and reduces the buyers' exposure to slippage on accumulated odd lots.   ",No
A method and system for mail payment evidencing includes processing a collation of mail (1020) where the collation is one of a series of mail collations being created. Payment rating parameters are determined for carrier services (1012) to be associated with the mail collation in process. It is determined if a previously generated digital token (1008) associated with a previous mail collation which was not completed is suitable for use on said mail collation in process. The previously generated digital token is utilized for the mail collation (1020) in process if the previously generated digital token is suitable for use on said mail collation in process. The created mail collations may be submitted to a carrier service (1012) with a digitally signed statement of mailing (1018). &lt;IMAGE&gt;,No
" The invention relates to a method of and apparatus for optically scanning bank notes (38), the method including the steps of transmitting the bank notes (38) along a transport path (26), illuminating each of the bank notes (38) from one side of the transport path (26) and forming a representation of the bank note (38) utilizing a photo-electric means (34) located on the opposite side of the transport path (26). The invention is characterized by determining the location of any defect (67) in the bank note (38) in relation to the boundaries (75,81,83,85) of the bank note (38) and determining whether or not the bank note (38) is acceptable for use in an automated teller machine (ATM), dependent on the location of any detected defect (67). &lt;IMAGE&gt;[EP0766208A1] ",No
" The invention relates to a method of and apparatus for optically scanning bank notes (38), the method including the steps of transmitting the bank notes (38) along a transport path (26), illuminating each of the bank notes (38) from one side of the transport path (26) and forming a representation of the bank note (38) utilizing a photo-electric means (34) located on the opposite side of the transport path (26). The invention is characterized by determining the location of any defect (67) in the bank note (38) in relation to the boundaries (75,81,83,85) of the bank note (38) and determining whether or not the bank note (38) is acceptable for use in an automated teller machine (ATM), dependent on the location of any detected defect (67). &lt;IMAGE&gt; ",No
