Abstract,IsLitigated
" An environmental, health and safety (EH&amp;S) compliance system provides for real-time exchange of EH&amp;S data from various remote and disparate data sources. These sources are typically located within a client's firewall and accessed using a data uploader component. The data are then sent securely to a data importer, which can reside either behind the client's firewall or hosted externally. The importer is the main component that accepts the data from the data uploader. The data importer can also accept data securely from the client's internal system when prohibited by the client's security policy to allow inside the firewall polling. The uploader resides usually behind the client's firewall, typically on a central server and comprises an intuitive user interface and underlying secure architecture to facilitate data transfer. It has a user interface to enable client-side control. The uploader component utilizes the secure data access technologies such as from Microsoft Corporation and other third party providers to connect to and integrate with disparate data sources while utilizing an extensible markup language (XML) Web Service technology to securely transfer data to the importer component. Usually the data are acquired by receiving exported data from third-party system or by interfacing with those systems using application programming interfaces or other access techniques. ",Yes
" A wristwatch having a built-in verification data IC chip generates a password. A portable terminal stores a first URL which specifies personal information of a user stored in a personal server, and transmits the first URL to a settlement device. The settlement device serves as a network access port for the portable terminal. The personal server is a server which manages personal data of the user that is distinguished by the first URL, and communicates with the settlement device and a service server via a network. The service server is a server for performing processing distinguished by a second URL. The service server executes the processing thereof by communicating with the settlement server and personal server via the network. Thus, the user can receive various types of services. Accordingly, a service providing system can be used with a portable terminal that does not hold any personal information therein. &lt;??&gt;The invention is particularly useful in the fields of electronic payment systems, electronic access systems for controlling the access of persons to restricted areas, ticket vending systems, passage surveillance systems, road toll systems, and medical record managing systems. Preferrably, personal verification is performed by checking fingerprints, iris patterns, voiceprints or other predetermined portions of the person's body. &lt;IMAGE&gt; [EP1213673A2] ",Yes
" In an Internet-based process, a method of integrating paper-based business documents requiring an original signature with electronic data about those documents, and for later retrieving the data entered by the end user to create the documents is characterized by the steps of having the end user enter all required information for creating the required document, saving the gathered data in a database, associating the saved data with a unique identification code, and printing the unique identification code on the paper-based document when it is printed by the end user. The method can further include verification steps for the business client to independently verify the information entered, certification steps for the end user to certify the information entered, and fraud detection elements to protect against altered information on the documents. The printed paper-based document is signed by the end user, and submitted with supporting documentation. When the document is received by the business client, the business client inputs the identification code which is then used to access the stored data, and populate the business client's own database with all of the data used to create the original documents. All data entry is completed and verified by the end user, thus virtually eliminating data entry by the business client. ",No
A patient claim data processing system responds to and initiates clinical events and attains early accurate claim data during a patient healthcare encounter cycle to support prompt claim data validation and editing both for individual claim elements and for a completed claim to improve claim accuracy prior to claim submission to a payer. The system submits accurate claims to payers and receives remittance advice from payers and applies rules to the advice. A system processes financial data related to provision of healthcare to a patient in response to clinical events. The system includes an interface processor for receiving a message identifying an event (21) and a related change in healthcare data concerning a patient and also includes a source of rules (74) for determining characteristics associated with reimbursement for provision of an individual service to a patient. A rules processor initiates application of a rule derived from the rules source to process financial data concerning provision of the individual service to the patient in response to receiving the message identifying the event. A result processor initiates an action in response to a result derived by the application of the rule to process the financial data. The rules processor also validates the financial data complies with the rule.|,Yes
" An apparatus and system for allowing customers to purchase boutique or specialty items directly from a supplier or wholesaler. The items for purchase are those conventionally available only through retailers such as local boutiques or specialty shops. An example would be salon quality hair care products. The system allows a customer to visit a website on a computer network, such as the Internet, and place an order for the product by providing information on which products are desired for purchase, the mailing address to which the products are to be sent, payment type, and optionally selecting a local retailer the customer enjoys frequenting to which the profits are to be directed. The supplier then processes the order and sends the customer the desired products, charging the customer normal retail prices. The supplier protects its business relationships with the local retailer by crediting the retailer for some or all of the profit the retailer normally would have received had it made the sale of the product. The recipient retailer is either chosen by using the retailer selected by the customer during the ordering process or, if a retailer was not chosen, by determining that product-carrying boutique which is geographically closest to the mailing address given by the customer. ",No
" An electronic exchange creates and distributes value among trading partners in a trade. Trading agents for the trading partners use a value manager to store true values for a trading element in the trade. The true values are the values perceived by the trading partner, but are not shown to other trading partners. These true values vary with attributes of the trading element. The attributes modify the trading element and are valued differently by different trading partners. A trade manager receives offers from trading agents. The offers are sent with the true values and the attribute values. The trade manager compares true values of buyers and sellers across a range of attribute values. Net values are computed as the difference of a buyers' sum and a sellers' sum. The buyers' sum is the sum of all true values from buyer trading agents, while the sellers' sum is the sum of the true values of all seller trading agents. The trade manager finds a set of attribute values that has a maximum net value. The trade is conducted for the trading element with the attributes that maximizes the net value. The net value is then allocated among the electronic exchange and the buyer and seller trading partners. ",Yes
" A system, method and computer program for ordering, paying for and delivering goods and services through the use of certificates. These certificates insure that the buyer is only billed once for the good or service purchased and only for the correct amount. This system, method and computer program employs the authentication center used to enable access to a telecommunication infrastructure to bootstrap a public-key infrastructure. This system, method and computer program will validate the identity of the mobile station being used utilizing log term keys stored in the mobile station and an authentication center. The system, method and computer program will then utilize these keys and variables to generate digital certificates and signatures which enable the purchase of goods and services using a mobile station. The gateway will then verify the authenticity of any charges made based on the digital certificates and signatures received. Thus, a user of this system, method and computer program can purchase goods and services without fear of fraud or errors. This mobile station may be a cellular phone and when used with this system, method and computer program the cellular phone may be used similarly to a credit card but with the advantage of little possibility of fraud or error. ",Yes
" The present invention discloses a pulling device for a container inspection system including a pulling vehicle ( 1 ) arranged inside an inspection passage, a winch ( 5 ) and wire tension mechanisms ( 6,6 '). Front and rear ends of the pulling vehicle are connected to a wire rope so as to drive the pulling vehicle to move back and forth inside the inspection passage. The wire rope connected to front and rear ends of the pulling vehicle is wound around a wire tension mechanism arranged at front and rear ends of the inspection passage and is turned around by a swerving pulley ( 2 ) which is positioned at the same horizontal plane as that of the wire rope, the pulling vehicle, and the wire tension mechanisms, then the wire rope passes through the vertical pulley block, and finally it is connected to a single winding drum ( 4 ) of the winch ( 5 ) and wound around the single winding drum ( 4 ) respectively. Compared with the prior arts, the present invention is advantageous in reduction in equipment investment and decrease in area occupied by the pulling device. Further, the inspection operation can be carried out more reliably and safely. ",Yes
" This invention uses a computer program to mine preexisting private branch exchange configuration data located in a variety of preexisting source private branch exchange configuration databases. The computer program either creates a new private branch exchange configuration database from parts of existing private branch exchange configuration databases or modifies an existing private branch exchange configuration database. The computer program replaces the current systems reliance upon manual data entry by data engineers to configure the operation of a new telecommunication switch or replace the software in a telecommunication switch that was damaged or requires a new private branch exchange configuration data configuration. This invention provides accurate and timely customer information, significantly decreases the time interval for engineering a new database, decreases the research and data entry time, decreases the interval for lab planning and project management, improves private branch exchange configuration database integrity, provides a cleaner private branch exchange configuration database, reuses existing data eliminating double data entry, reuses some existing software code, and uses preexisting office data administration tools and provides a platform for future growth and expandability. By accomplishing these tasks, the telecommunication switch manufacturer or telecommunication switch operator saves time, money and decreases time-to-market product and service schedules.  ",Yes
" This invention uses a computer program to mine preexisting private branch exchange configuration data located in a variety of preexisting source private branch exchange configuration databases. The computer program either creates a new private branch exchange configuration database from parts of existing private branch exchange configuration databases or modifies an existing private branch exchange configuration database. The computer program replaces the current systems reliance upon manual data entry by data engineers to configure the operation of a new telecommunication switch or replace the software in a telecommunication switch that was damaged or requires a new private branch exchange configuration data configuration. This invention provides accurate and timely customer information, significantly decreases the time interval for engineering a new database, decreases the research and data entry time, decreases the interval for lab planning and project management, improves private branch exchange configuration database integrity, provides a cleaner private branch exchange configuration database, reuses existing data eliminating double data entry, reuses some existing software code, and uses preexisting office data administration tools and provides a platform for future growth and expandability. By accomplishing these tasks, the telecommunication switch manufacturer or telecommunication switch operator saves time, money and decreases time-to-market product and service schedules. ",Yes
" A probe card assembly includes a probe card, a space transformer having resilient contact structures (probe elements) mounted directly thereto (i.e., without the need for additional connecting wires or the like) and extending from terminals on a surface thereof, and an interposer disposed between the space transformer and the probe card. The space transformer and interposer are   stacked up   so that the orientation of the space transformer, hence the orientation of the tips of the probe elements, can be adjusted without changing the orientation of the probe card. Suitable mechanisms for adjusting the orientation of the space transformer, and for determining what adjustments to make, are disclosed. The interposer has resilient contact structures extending from both the top and bottom surfaces thereof, and ensures that electrical connections are maintained between the space transformer and the probe card throughout the space transformer's range of adjustment, by virtue of the interposer's inherent compliance. Multiple die sites on a semiconductor wafer are readily probed using the disclosed techniques, and the probe elements can be arranged to optimize probing of an entire wafer. Composite interconnection elements having a relatively soft core overcoated by a relatively hard shell, as the resilient contact structures are described. ",No
" An automated teller machine (ATM) ( 10 ) includes an input device ( 16 ) a card reader ( 20 ), a cash dispenser ( 24 ), and an output device ( 18 ). The ATM is operative to read account information from a card with the card reader and validate a user PIN input through the input device. The ATM is also operative to dispense cash with the cash dispenser and dispense digital content with the output device responsive to user input selections. The ATM is further operative to charge a user fee to an account associated with the card for the dispense of cash and digital content. Digital content dispensed by the ATM may include sound recordings such as MP3 files, video files, books, and other digital data. To dispense sound files the output device may include a sound system that is operative to output audio that corresponds to the dispensed sound recording files. The sound files may be acquired by the ATM from a digital information source on the Internet or other network. Licensing fees associated with the dispense of the digital files may be transferred to a source or licensing entity associated with the digital content. ",Yes
" A computer-implemented method of scheduling an appointment at a plurality of facilities providing a plurality of services, comprising receiving a packet of client information from a client, the client information including personal data, service data, client appointment preference data, and payment data; comparing the service data to a set of service constraints in order to determine any limitations on the scheduling of the appointment; inputting the client information into a scheduling server; verifying the client information; generating a predetermined number of appointment candidates based upon an analysis of the client information and the appointment scheduling limitations; communicating the appointment candidates to the client; generating an appointment based upon the client's selection of one of the appointment candidates; generating appointment information related to the appointment, the appointment information including the client information, the service constraints, an appointment date, an appointment time, the identity of the available facility, and the resources to be utilized; reporting at least a portion of the appointment information to the client and all of the client information to the available facility; and confirming the appointment in the scheduling server. A data processing system for scheduling an appointment from among a plurality of facilities is also disclosed. ",No
" Systems, methods, and computer program products are disclosed for establishing and using credit limits between counterparties and for managing risk in the trading of financial interests. The invention provides credit filtered views of executable market information to trading parties. By setting credit limits used to provide credit-filtered views, the invention provides trading parties the ability to control the amount of future financial exposure that the trading party will incur with any counterparty in one or more present-and/or future time periods in trades by the trading party during a trading session. A trading party may establish and use credit limits with potential counterparties in the trading of financial interests having a current or future financial exposure such as foreign exchange (  FX  ) forwards contracts, forwards contracts in commodities, e.g., precious metals, energy, etc., stock options, futures contracts, bonds, loan contracts, money market certificates, other fixed income securities, etc. The credit information is used by a central computer to provide credit filtered market views to trading parties. During a trading session, the credit remaining of a set credit limit between the trading party and the respective counterparty is changed according to trades executed between the trading party and the counterparty. ",Yes
" The present invention provides a method for tokenless biometric access to financial accounts at an institution using an automated teller machine. This method comprises a user registration step, wherein a user registers with an electronic identicator one or more registration biometric samples and one or more user financial accounts. During an initiation step, the user initiates an account access at an automated teller machine by submitting at least one bid biometric sample directly from the user's person, wherein no portable man-made memory devices such as smartcards or swipe cards are used by the user. In at least one transmission step, an account access request message comprising the user's bid biometric is forwarded from the automated teller machine to the electronic identicator. During a user identification step, the electronic identicator compares the bid biometric sample in the account access request message with a registration biometric sample, to produce either a successful or failed identification of the user. Upon successful identification of the user, at least one financial account of the user is retrieved, and in an access step, after successful identification of the user and successful financial account retrieval, the user is allowed to access the user financial account. ",No
" A client is connected to a server for providing electronic commerce services in electronic commerce. An order is transmitted for a product in response to an input by a user to the server through a communications network. A trading identifier associated with the order and data on the contents of the order is received from the server, which is stored in a storage device. Associated trading processing information includes a present status of processing for processing initiated for the order, a present status of processing for delivery of the product corresponding to the order, a present status of processing for payment processing for the trading, and the trading identifier. During updating, a trading identifier is compared with trading identifiers included in the stored trading processing information, and a warning is output if they are not coincident. Updated trading processing information is added to the trading information stored in the storage device if they are coincident. The present status of processing for the processing initiated for the order, processing for delivery of the product corresponding to the order, and processing for the payment processing for the trading are managed until the order processing, delivery, and payment processing are completed. ",Yes
" A postage metering system includes a plurality of meter printers operatively connected as part of a metering network and operating as client meter printers on the meter printer network. At least one postal security device (PSD) is coupled to at least one of the client meter printers (local client meter printer). The PSD includes unique identification the ability to store postal value and generate digital signatures. The client meter printers function as a postage metering network wherein a client meter printer other than the local client meter printer (remote client meter printer) requests evidence of postage payment from the PSD for concluding a postage metering transaction. The local client meter printer functions as a meter server and the remote client meter printer functions as a meter client on the postage metering network. The remote client meter printer initiates a postage metering transaction in the PSD by sending a request for evidence of postage payment to the local client meter printer. The local client meter printer sends the request for the evidence of postage payment to the PSD, receives transaction information from the PSD and sends the evidence of payment to the remote client meter printer for subsequent printing.[US6081795A] ",No
" In an electronic cash system, K sets of blind signature information are derived from secret information containing identification information of a user (200, 400), K/2 sets of them are opened and a bank (100) attaches a blind signature to the remaining K/2 sets of information. The user obtains a signed license from the blind signature. The user generates blind signature information from the license and a desired amount of money and gets a blind signature of the bank to the blind signature information and obtains electronic cash signed by the bank from the blind signature. The user presents to a shop (300) a residue power root of a node in a money hierarchial structure and the electronic cash, corresponding to the amount of money to be used, and the shop verifies their validity and, if they are valid, offers inquiry information to the user. The user offers, as response information, a residue power root of the node corresponding to the amount of money to be used to the shop. The shop verifies the validity of the response information and, if it is valid, acknowledges the payment with electronic cash of the amount of money to be used. &lt;IMAGE&gt; ",No
" PROBLEM TO BE SOLVED: To provide an optical exchange that properly copes with a sequential increase in a switching capacity by placing optical amplifiers to compensate the loss of an optical signal in a form rich in the extension performance. |SOLUTION:  In the case that an optical switch section being a component of the optical exchange consists of 3-stage circuits, an optical amplifier is provided to an input side and an output side of a 1st stage optical spatial switch and the optical spatial switch and the optical amplifiers at both the input and output sides are used for an extension unit in the case of extending the switching capacity. Similarly an optical amplifier is provided to an input side and an output side of a 3rd stage optical spatial switch and the optical spatial switch and the optical amplifiers at both the input and output sides are used for an extension unit in the case of extending the switching capacity. Thus, even in the case of initial setting state or the like where only a part of the available maximum switching capacity is in use, the initial investment is reduced not providing excessively the optical amplifiers[JP11239369A] ",Yes
