Abstract,IsLitigated
" It is an object to provide a mobile terminal device, such as a mobile phone using electronic-money service, in which information is easily managed upon installing a value processing function to the mobile terminal device. An IC chip for non-contact IC card is installed to a mobile phone 7 having an Internet access function. At the selling time of the mobile phone 7 , an application program is not installed in the IC chip. A user purchases the mobile phone 7 , thereafter, accesses an electronic-money server 2 from the mobile phone 7 , and installs a value processing program to the IC chip. The electronic-money server 2 and the mobile phone 7 are cooperated and install the value processing function. In the installing processing, the mobile phone 7 receives secret information from the electronic-money server 2 for the purpose of ensuring the security, and installs the information to the IC chip. ",Yes
A system and method include means for processing a cryptographic certificate adapted to provide security functionality. A register means (244) is provided and means (224) for adjusting the register means to account for services when the cryptographic certificate is processed. The register means may be for storing funds. Means are provided for processing a digital token providing proof of postage payment and means are also provided for processing a cryptographic certificate adapted to provide security functionality. Funds stored in the register means are debited when the digital token is processed and when the cryptographic certificate is processed. Processing the cryptographic certificate may involve many functions such as providing security services and/or certificate management functions (including generating and verifying cryptographic certificates) and/or key management functions and/or access to any needed private keys to perform security services. Processing the digital token may include generating the digital token or issuing the digital token. &lt;IMAGE&gt;,No
" An electronic wireless hand held multimedia d evice includes a microprocessor and more than one wireless transceiver modules enabling wireless communications over a variety of standards, including Cellular (e.g., GSM, CDMA, GPRS, 3G), 802.11 (e g., WLAN), and short range (e.g., Bluetooth, infrared, RFID) for the retrieval, processing, and delivery of multimedia data to/from remote data resources (e.g., Internet, servers). The hand held device can include any of: a touch sensitive display screen configured to display multimedia data including video, text, GPS maps, and accept user input: a cartridge reader configured to exchange data with an electronic cartridge; a GPS module configured to operate with mapping resources and provide location information and GPS mapping; a mobile payment module enabling mobile payments via a variety of billing arrangements; a security module enabling protected data management and communications security; a video camera enabling the capture, storage, processing, and transmission of video and pictures. ",No
" Methods and systems are provided for issuing a new type of security, referred to herein as a   Guarantee Certificate,   which offers payments to a holder contingent upon the occurrence of specified risk-related events that would typically trigger an insurance or guaranty payment. Guarantee Certificates offer a mechanism for separating certain payment rights associated with a pool of assets (which may or may not be securitized) from the remaining payment rights associated with the pool, such that the payment rights form separate, transferable financial instruments. These instruments evidence an obligation of a mortgage insurer or a securities guarantor to make payments triggered by certain default-related events involving a corresponding (in the case of a mortgage insurer) or an underlying (in the case of a securities guarantor) mortgage loan or loans. A data processing system creates and maintains information corresponding to the Guarantee Certificates. A Guarantee Certificate may be tradable by the holder. ",Yes
" A method and apparatus for information presentation and management in an online trading environment are provided. According to one aspect of the present invention, person-to-person commerce over the Internet is facilitated by providing prospective buyers the ability to quickly preview items for sale. Images are harvested from a plurality of sites based upon user-supplied information. The user-supplied information includes descriptions of items for sale and locations from which images that are to be associated with the items can be retrieved. Thumbnail images are created corresponding to the harvested images and are aggregated onto a web page for presentation at a remote site. According to another aspect of the present invention, a user may submit a query to preview items for sale. After receiving the query, thumbnail images corresponding to items that satisfy the user query are displayed, each of the thumbnail images previously having been created based upon a user-specified image. ",No
" Methods, devices, and systems are provided in a multi-level computer architecture which provides improved capabilities for managing courseware and other content in a shared use operating environment such as a computer network. In particular, the invention provides a commercial networked instruction content delivery method and system which does not exclude synchronous sharing but is focused on asynchronous sharing. Security in the architecture provide content property holdlers with the ability to know how many minutes of use an individual made of licensed material and with increased certainty that their material cannot be used, copied, or sold in usable form unless and until a user site is connected or reconnected to a minute-by-minute counter which is located off the premises of the user. This security link helps protect software and other works which are being sold or licensed to an individual, organization, or entity, and creates income opportunities for owners of such content. ",No
" A hearing aid having two physically separate receivers, one for outputting low frequency (LF) acoustic sounds and another for outputting high frequency (HF) acoustic sounds. The LF receiver's output port is connected to a tube in which the HF receiver is inserted. The LF acoustic sounds either flow around the HF receiver, which include standoffs to space the HF receiver away from the inner tube wall, or through a channel in the HF receiver. At the output of the HF receiver, the LF and HF acoustic sounds are combined to form an acoustic signal that is transmitted to the ear canal. The LF receiver can be optimized for compliance, distortion, resonance frequency, and output. Its orientation is selected for reducing the overall size of the hearing aid. The HF receiver is smaller and placed far away from any microphone(s), reducing feedback effects, and may have a cylindrical or rectangular shape. [EP1871141A2] ",No
" A money handling mechanism 110 has a first port P1 for connection to a machine controller 130 and a second port P2 to which further money handling mechanisms can be connected. Different types of mechanism, such as a card acceptor 70 or a bill validator 100, can be connected to the second port P2 over a bus B. The first port P1 may be connected to one of several interface adapters 410 to 416, and the communications protocol used is selected accordingly. If the first port P1 uses the same protocol as the second port P2, signals are passed transparently between the first port P1 and the second port P2. Signals from the additional mechanism may be modified to be recognisable by the controller 130. The money handling mechanism 110 may convert between the denominations of currencies represented in the protocols over the first and second ports P1 and P2. &lt;IMAGE&gt; ",No
" A collectible trading card ( 10 ) includes an outer card ( 12 ) and an insert card ( 14 ). The insert card ( 14 ) contains an insert card image ( 44 ). The outer card ( 12 ) includes a first region ( 38 ) and a second region ( 40 ). The first region ( 38 ) includes a card aperture ( 24 ) that receives at least a portion of the insert card ( 14 ). The second region ( 40 ) is moveable from a first position ( 41 A) to a second position ( 41 B). In the first position ( 41 A), the insert card ( 14 ) is inhibited from being removed from the card aperture ( 24 ). In the second position ( 41 B), the insert card ( 14 ) can be removed from the card aperture ( 24 ). ",Yes
" Automated generation of reports based on insurance coverage of youthful drivers. Insurance carriers can automatically obtain, at appropriate times, customized reports for use in monitoring insurance coverage of youthful drivers. The youthful drivers can be newly-licensed persons who reside with insured persons. The reports can indicate whether the youthful drivers are insured by a particular insurance carrier and/or whether they are uninsured persons. The insurance carriers can designate the reports' format, content, generation times, and output times. In designating the output times, the insurance carriers can designate whether and/or when to delay output of certain generated reports. In addition, the insurance carriers can designate whether and/or when to update and/or verify the contents of each generated report prior to outputting the report. Allowing insurance carriers to designate when, how, and in what format, they wish to receive the reports permits for more effective, more efficient, continuous monitoring of youthful drivers. ",Yes
" A system and method for merchant function assumption of Internet checking and savings account transactions enables a service provider to take over all merchant type transactions and provide a merchant, such as an Internet merchant, with an approved order and appropriate credit for the transaction. A service provider server receives an electronic check or a payment instruction for the merchant from a customer. The payment instruction includes, for example, the originator's digital certificate and payment and purchase information, including the originator's checking or savings account number. The payment instruction is automatically sent to a customer's bank's server, which confirms the availability of funds for the payment. A confirmation of the availability of funds is automatically sent to the merchant, and a credit for the payment is automatically sent to the merchant's account. In addition, the service provider can consolidate order and settlement transactions, which saves transaction costs for the merchant. ",Yes
" A method for facilitating a transaction includes: storing card association data entries, each including at least a card association number (ICA), a country associated with the ICA, and a plurality of bank identification numbers (BINs) associated with the ICA; receiving a number request originating from a first country and identifying a second country; identifying a specific data entry where the included country corresponds to the second country; identifying a subset of BINs of the plurality associated with the ICA in the specific data entry; transmitting the identified subset of BINs; receiving an authorization request for a financial transaction originating from the second country and including at least a payment card number, the number being associated with a BIN included in the subset of BINs; processing the financial transaction as a local transaction and not a cross-border transaction; and transmitting an authorization response indicating approval or denial of the financial transaction. ",No
" The present invention provides a system and method allowing customers to conduct a remote banking transaction at a fuel dispenser, including obtaining cash in association with the transaction at the dispenser or a common terminal in the dispenser forecourt. The system may include a cash dispenser at the dispenser, fueling position, or the central terminal, or, alternatively, a delivery system configured to deliver cash from a central location to the customer at the dispenser, fueling position, or central terminal. During a transaction for purchasing fuel or other products associated with the service station, a customer is provided an opportunity to conduct a remote banking transaction. Providing a customer the opportunity to conduct such a transaction in association with a dispenser transaction will attract more customers to the station because of convenience as well as provide customers with more disposable cash to spend at the associated quickserve restaurants and convenience store. ",No
" A promotional item for being dispensed in a vending machine that dispenses a product item having a product within a product container upon receipt of a predetermined payment amount. The promotional item includes a product container similar to the product container of the product item, and a compressed fabric article contained within the product container and having an exterior load bearing dimension substantially equal to an interior load bearing dimension of the container. According to an embodiment of the present invention, the product container comprises a plastic bottle cut into two pieces, and the interior load bearing dimension comprises an inner diameter of the bottle. In addition, the compressed fabric article is generally cylindrical and the exterior load bearing dimension comprises an outer diameter of the compressed article. The promotional item further comprises means for securing the two pieces of the bottle together with the compressed fabric article contained therein. ",No
" A supply chain network where customers, suppliers, logistics providers, carriers, and financial institutions are all connected to a centralized supply chain server. The server receives forecasts from the customers detailing the orders that the customers desire. These forecasts are analyzed by the supply chain server to ensure that they conform to contractual agreements and do not contain errors. The forecasts are also used to warn the suppliers of future demands so that the suppliers can anticipate demands and plan inventory accordingly. Once supplier demand issues are resolved, the forecasts are sent to the suppliers in groups so that the suppliers prepare a smaller number of large orders. The supply chain server also controls the processes involved in distributing the product from the suppliers to the customers including the generation and payment of invoices. A form of financing the customers' purchases, made possible by the supply chain architecture, is also disclosed. ",Yes
" Provided is an integrated financial account that encompasses all types of transactions. The balance of the account is determined by withdrawals and deposits regardless of the type of transaction to which the withdrawal or deposit corresponds. If a debt is presented, the net balance of the account is adjusted downward accordingly. If a credit is presented, the balance is adjusted upward accordingly. If an account has a negative balance, the balance is adjusted to reflect interest expense. If account has a positive balance, an agreed upon interest is accrued. A balance of the integrated account can include collateral and obligations that the customer places in the account. Information about the account can be downloaded to a customer's personal financial management (PFM) tools, which could segment the account into separate components corresponding to traditional accounts. The integrated account can be used as collateral for insurance with balance adjusted based upon risk. ",Yes
" A credit card system is provided which has the added feature of providing additional limited use credit card numbers and/or cards. These numbers and/or cards can be used for a single or limited use transaction, thereby reducing the potential for fraudulent reuse of these numbers and/or cards. The credit card system finds application to   card remote   transactions such as by phone or Internet. Additionally, when a single use or limited use credit card is used for   card present   transactions, so called   skimming   fraud is eliminated. Various other features enhance the credit card system which will allow secure trade without the use of elaborate encryption techniques. Methods for limiting, distributing and using a limited use card number, controlling the validity of a limited use credit card number, conducting a limited use credit card number transaction and providing remote access devices for accessing a limited use credit card number are also provided. ",No
" Provided is a real-time method for calculating a credit report based upon information associated with a single, integrated financial account. The account has an associated balance based upon deposits and withdrawals, regardless of the type of transaction that generated a particular deposit or withdrawal. An account history is maintained and employed to calculate a credit rating. The rating is determined by an inspection of the integrated account. Information associated with the account is transferable. As deposits and withdrawals are made to an account, the credit rating can be adjusted in real-time. Metric information such as the frequency of deposits and withdrawals can be used as a factor in the calculation of a credit rating. Payment made by another customer on a co-signed loan, can also be a factor. Collateral deemed appropriate may be placed in the account and the customer's credit rating adjusted to reflect the value of the collateral. ",Yes
" The invention provides a user interface, such as used by an electronic trading hub. The interface includes a representation that describes instances in which a participant has won some units, but less than the number of items initially bid on. The representation of this partial win is displayed on web pages that present information to a user. Another representation shows start and end times for at least some of the markets in which the user is currently participating, and the start and end times for future markets. Color-coding of temporal events may also be included in the graphical representation. A representation of activities occurring in markets owned by a user is generated and displayed. Such representations useful to commercial entities which take positions as both buyers and sellers. Another representation identifies which type of market is referred to such as English auctions, RFBs (request for bids), Dutch auctions and others. ",Yes
" A hearing aid having two physically separate receivers, one for outputting low frequency (LF) acoustic sounds and another for outputting high frequency (HF) acoustic sounds. The LF receiver's output port is connected to a tube in which the HF receiver is inserted. The LF acoustic sounds either flow around the HF receiver, which include standoffs to space the HF receiver away from the inner tube wall, or through a channel in the HF receiver. At the output of the HF receiver, the LF and HF acoustic sounds are combined to form an acoustic signal that is transmitted to the ear canal. The LF receiver can be optimized for compliance, distortion, resonance frequency, and output. Its orientation is selected for reducing the overall size of the hearing aid. The HF receiver is smaller and placed far away from any microphone(s), reducing feedback effects, and may have a cylindrical or rectangular shape.[EP1871141A2] ",No
" An apparatus ( 10, 240, 300 ) includes a signpost ( 11, 241 - 256, 322, 612, 623, 626 - 628, 652, 661, 682, 686, 703 ) which transmits signpost signals ( 24 ) that are received by a tag ( 12, 271 - 275, 301 - 316, 395 - 397, 616 - 618, 641 - 643, 653, 656 - 657, 662 - 664, 679, 708, 711 ). The tag in turn transmits radio frequency beacon signals ( 72 ) which are received by a reader ( 13, 261, 319, 521 - 530 ). The tag can vary the duration of the beacon signals, for example in dependence on whether it is currently receiving a signpost signal. Further, the tag can dynamically vary the transmission rate and/or transmission power of the beacon signals, for example following receipt of a signpost signal. Varying these parameters can facilitate compliance with governmental regulations. ",Yes
" In an information processing system comprising a redundantly furnished plurality of second information processing apparatuses being commonly connected with a first information processing apparatus through an information transmission path to supervise the first information processing apparatus, and a third information processing apparatus being connected with the second information processing apparatus through an information network to manage the second information processing apparatus, wherein each of the second information processing apparatuses comprises a connection confirmation control logic for trying to transmit connection confirmation information to the third information processing apparatus through the information network in compliance with an instruction being given by the one representative second information processing apparatus, and the third information processing apparatus comprises a maintenance management control logic for collecting the connection confirmation information arriving from each of the second information processing apparatuses and transmitting collected results by e-mail to a manager of the first information processing apparatus. ",Yes
" An advertisement portfolio model reduces risk in an advertisement transaction for an individual advertisement product. First, a relational expression is used to determine a comprehensive advertisement risk management index for statistically representing a maximum unexpected loss amount to which the advertisement product is subject at a certain probability during the advertising campaign period. Second, a plurality of correlation coefficient data of the advertisement product are calculated from the observational data of the advertisement product. Third, an optimal combination of the advertisement products is determined in order to analyze at least either one of an effect, an efficiency or a risk of the advertisement product based on the relational expression for determining the comprehensive advertisement risk management index and the plurality of correlation coefficient data or the observational data which has taken the correlation into account indirectly, such that a sponsor can determine an optimal combination of the advertisement products. ",Yes
" Automated generation and output of customized reports based on the insurance claim records of insured persons. Insurance carriers can automatically obtain customized reports for use in monitoring insured persons' insurance claim records for previously-unavailable claim information. Each insured person can be insured on a recently-executed insurance policy of an insurance carrier. An insurance carrier's customized report can include, for each insured person, claim information related to the insured person that was unavailable to the insurance carrier before execution of the insurance policy. The customized report can also include claim information related to the insured person that was unavailable before a specified period of time before execution of the insurance policy. The insurance carriers can designate the reports' format and content. Allowing insurance carriers to designate how, and in what format, they wish to receive the reports permits for more effective and more efficient monitoring of insured persons' claim records. ",Yes
" A general-purpose payment card product is linked to a designated reimbursement account. A payment card authorization request is obtained, with a full amount and a reimbursement eligible amount included therein, based on a transaction with the payment card product at a merchant. In one aspect, a payment card authorization response is returned to the merchant from an issuer of the payment card product, based on the full amount. A funding request is initiated, for the reimbursement eligible amount, from the designated reimbursement account. The payment card product and the designated reimbursement account are managed separately. In an alternative, the authorization request is intercepted by an operator of a payment network. The operator initiates a first operator authorization request for the reimbursement eligible amount, and a second operator authorization request for the full amount less the portion of the reimbursement eligible amount, and returns a coordinated response to the merchant. ",No
" A system enables lottery ticket transactions in a fueling forecourt by permitting the purchase of lottery tickets at a fuel dispenser. In the system, customers pay for lottery tickets through the fuel dispenser payment acceptors in conjunction with fuel purchases. Payment may be by cash, credit, or wireless credit storage device, with the cost of the lottery ticket or tickets added to the cost of the fueling transaction. The lottery ticket dispensers may be integrated within the individual fuel dispensers, one to each dispenser, or may be apart from the fuel dispensers with one or more lottery ticket dispensers located elsewhere within the forecourt area. The system provides a range of lottery ticket choices including pre-printed tickets, random-number tickets, and customer-number tickets. The system provides a convenient alternative to in-store lottery ticket transactions by allowing fueling customers to purchase and receive lottery tickets without need of entering the store. ",No
